[
  { "from": "chm210-01-what-is-reaction-rate", "to": "chm210-02-collision-theory", "strength": "soft", "reason": "Collision theory explains the rate concept just introduced." },
  { "from": "chm210-01-what-is-reaction-rate", "to": "chm210-03-measuring-concentration", "strength": "hard", "reason": "You measure concentration over time in order to obtain a rate." },
  { "from": "chm210-01-what-is-reaction-rate", "to": "chm210-04-rate-law-form", "strength": "hard", "reason": "A rate law expresses the rate that was just defined in terms of concentrations." },
  { "from": "chm210-02-collision-theory", "to": "chm210-04-rate-law-form", "strength": "soft", "reason": "Collision theory motivates why rate depends on concentration." },
  { "from": "chm210-04-rate-law-form", "to": "chm210-05-reaction-order", "strength": "hard", "reason": "Reaction order is the exponent in the rate law." },
  { "from": "chm210-03-measuring-concentration", "to": "chm210-06-method-of-initial-rates", "strength": "hard", "reason": "The initial-rates method uses measured concentration-time data." },
  { "from": "chm210-05-reaction-order", "to": "chm210-06-method-of-initial-rates", "strength": "hard", "reason": "The method's purpose is to determine reaction order." },
  { "from": "chm210-05-reaction-order", "to": "chm210-07-integrated-first-order", "strength": "hard", "reason": "The first-order integrated law applies to a first-order reaction." },
  { "from": "chm210-03-measuring-concentration", "to": "chm210-07-integrated-first-order", "strength": "soft", "reason": "The integrated law is fitted to concentration-time data." },
  { "from": "chm210-05-reaction-order", "to": "chm210-08-integrated-second-order", "strength": "hard", "reason": "The second-order integrated law applies to a second-order reaction." },
  { "from": "chm210-07-integrated-first-order", "to": "chm210-08-integrated-second-order", "strength": "soft", "reason": "The second-order derivation parallels the first-order one." },
  { "from": "chm210-07-integrated-first-order", "to": "chm210-09-half-life", "strength": "hard", "reason": "Half-life is derived directly from the integrated rate laws." },
  { "from": "chm210-08-integrated-second-order", "to": "chm210-09-half-life", "strength": "soft", "reason": "Half-life behaviour differs between first and second order." },
  { "from": "chm210-02-collision-theory", "to": "chm210-10-activation-energy", "strength": "hard", "reason": "Activation energy is the minimum collision energy from collision theory." },
  { "from": "chm210-10-activation-energy", "to": "chm210-11-arrhenius-equation", "strength": "hard", "reason": "The Arrhenius equation contains the activation energy explicitly." },
  { "from": "chm210-04-rate-law-form", "to": "chm210-11-arrhenius-equation", "strength": "hard", "reason": "The Arrhenius equation describes how the rate constant of the rate law varies with temperature." },
  { "from": "chm210-04-rate-law-form", "to": "chm210-12-reaction-mechanisms", "strength": "hard", "reason": "Mechanisms are proposed to explain the observed rate law." },
  { "from": "chm210-12-reaction-mechanisms", "to": "chm210-13-rate-determining-step", "strength": "hard", "reason": "The rate-determining step is one of the elementary steps in a mechanism." },
  { "from": "chm210-05-reaction-order", "to": "chm210-13-rate-determining-step", "strength": "soft", "reason": "Deriving a rate law from the slow step requires understanding order." },
  { "from": "chm210-10-activation-energy", "to": "chm210-14-catalysis", "strength": "hard", "reason": "Catalysis works by lowering the activation energy." },
  { "from": "chm210-12-reaction-mechanisms", "to": "chm210-14-catalysis", "strength": "soft", "reason": "A catalyst introduces an alternative mechanistic pathway." },
  { "from": "chm210-13-rate-determining-step", "to": "chm210-15-mechanism-validation", "strength": "hard", "reason": "Validating a mechanism means deriving its rate law from the slow step and comparing to data." },
  { "from": "chm210-06-method-of-initial-rates", "to": "chm210-15-mechanism-validation", "strength": "soft", "reason": "The experimental rate law used for validation comes from methods like initial rates." },
  { "from": "chm210-11-arrhenius-equation", "to": "chm210-15-mechanism-validation", "strength": "soft", "reason": "Temperature dependence can corroborate a proposed mechanism." }
]
