[
  { "from": "mth204-01-linear-equations", "to": "mth204-02-augmented-matrix", "strength": "hard", "reason": "You must know what a linear system is before encoding it as a matrix." },
  { "from": "mth204-02-augmented-matrix", "to": "mth204-03-gaussian-elimination", "strength": "hard", "reason": "Gaussian elimination is performed on the augmented matrix." },
  { "from": "mth204-01-linear-equations", "to": "mth204-03-gaussian-elimination", "strength": "soft", "reason": "Row operations correspond to manipulating the original equations." },
  { "from": "mth204-03-gaussian-elimination", "to": "mth204-04-reduced-row-echelon", "strength": "hard", "reason": "Reduced row-echelon form is the continuation of Gaussian elimination." },
  { "from": "mth204-05-matrix-operations", "to": "mth204-06-matrix-multiplication", "strength": "hard", "reason": "Multiplication builds on the basic matrix algebra of addition and scaling." },
  { "from": "mth204-02-augmented-matrix", "to": "mth204-05-matrix-operations", "strength": "soft", "reason": "Familiarity with matrix notation precedes matrix algebra." },
  { "from": "mth204-06-matrix-multiplication", "to": "mth204-07-identity-and-inverse", "strength": "hard", "reason": "The inverse is defined through matrix multiplication giving the identity." },
  { "from": "mth204-07-identity-and-inverse", "to": "mth204-08-computing-inverse", "strength": "hard", "reason": "You must know what an inverse is before computing one." },
  { "from": "mth204-04-reduced-row-echelon", "to": "mth204-08-computing-inverse", "strength": "hard", "reason": "Computing the inverse uses Gauss-Jordan row reduction." },
  { "from": "mth204-06-matrix-multiplication", "to": "mth204-09-determinant-2x2-3x3", "strength": "soft", "reason": "Determinants act on the square matrices whose algebra was just covered." },
  { "from": "mth204-09-determinant-2x2-3x3", "to": "mth204-10-determinant-properties", "strength": "hard", "reason": "Properties generalise the small-matrix computations." },
  { "from": "mth204-03-gaussian-elimination", "to": "mth204-10-determinant-properties", "strength": "hard", "reason": "The properties describe how row operations change the determinant." },
  { "from": "mth204-10-determinant-properties", "to": "mth204-07-identity-and-inverse", "strength": "soft", "reason": "A nonzero determinant signals invertibility, reinforcing the inverse concept." },
  { "from": "mth204-01-linear-equations", "to": "mth204-11-vector-spaces", "strength": "soft", "reason": "Solution sets of linear systems are the first examples of vector spaces." },
  { "from": "mth204-05-matrix-operations", "to": "mth204-11-vector-spaces", "strength": "soft", "reason": "Matrices under addition and scaling are themselves a vector space example." },
  { "from": "mth204-11-vector-spaces", "to": "mth204-12-linear-independence", "strength": "hard", "reason": "Linear independence is a property of vectors within a vector space." },
  { "from": "mth204-03-gaussian-elimination", "to": "mth204-12-linear-independence", "strength": "hard", "reason": "Independence is tested by row reducing the vectors." },
  { "from": "mth204-12-linear-independence", "to": "mth204-13-basis-and-dimension", "strength": "hard", "reason": "A basis is a maximal linearly independent set." },
  { "from": "mth204-11-vector-spaces", "to": "mth204-13-basis-and-dimension", "strength": "hard", "reason": "Basis and dimension are defined relative to a vector space." },
  { "from": "mth204-08-computing-inverse", "to": "mth204-14-eigenvalues", "strength": "soft", "reason": "Comfort with matrix computation supports eigenvalue work." },
  { "from": "mth204-10-determinant-properties", "to": "mth204-14-eigenvalues", "strength": "hard", "reason": "The characteristic equation sets a determinant to zero." },
  { "from": "mth204-06-matrix-multiplication", "to": "mth204-14-eigenvalues", "strength": "hard", "reason": "The eigenvalue equation A v = lambda v is stated with matrix multiplication." },
  { "from": "mth204-14-eigenvalues", "to": "mth204-15-eigenvectors", "strength": "hard", "reason": "Eigenvectors are found for each eigenvalue already computed." },
  { "from": "mth204-04-reduced-row-echelon", "to": "mth204-15-eigenvectors", "strength": "hard", "reason": "Eigenvectors are found by solving a homogeneous system via row reduction." },
  { "from": "mth204-13-basis-and-dimension", "to": "mth204-15-eigenvectors", "strength": "soft", "reason": "Eigenspaces are subspaces described by a basis." },
  { "from": "mth204-15-eigenvectors", "to": "mth204-16-diagonalization", "strength": "hard", "reason": "Diagonalization is built from a full set of eigenvectors." },
  { "from": "mth204-07-identity-and-inverse", "to": "mth204-16-diagonalization", "strength": "hard", "reason": "Diagonalization writes A as P D P inverse, requiring the inverse." },
  { "from": "mth204-13-basis-and-dimension", "to": "mth204-16-diagonalization", "strength": "soft", "reason": "Diagonalizability depends on having a basis of eigenvectors." }
]
