[
  { "from": "bio301-01-energy-and-atp", "to": "bio301-02-redox-reactions", "strength": "soft", "reason": "Grasping ATP as energy currency makes electron-carrier chemistry easier to place, but redox can be studied on its own." },
  { "from": "bio301-01-energy-and-atp", "to": "bio301-03-metabolic-pathways", "strength": "hard", "reason": "Pathway diagrams are read in terms of energy captured and spent, so the ATP concept must come first." },
  { "from": "bio301-02-redox-reactions", "to": "bio301-05-glycolysis-overview", "strength": "hard", "reason": "Glycolysis produces NADH, so electron carriers must be understood before its yield makes sense." },
  { "from": "bio301-03-metabolic-pathways", "to": "bio301-05-glycolysis-overview", "strength": "hard", "reason": "Glycolysis is presented as a ten-step pathway diagram." },
  { "from": "bio301-04-glucose-structure", "to": "bio301-05-glycolysis-overview", "strength": "hard", "reason": "You cannot follow how glucose is broken down without knowing its structure." },
  { "from": "bio301-01-energy-and-atp", "to": "bio301-04-glucose-structure", "strength": "soft", "reason": "Understanding energy storage motivates why glucose bonds matter." },
  { "from": "bio301-05-glycolysis-overview", "to": "bio301-06-glycolysis-regulation", "strength": "hard", "reason": "Regulation only makes sense once the pathway's steps are known." },
  { "from": "bio301-05-glycolysis-overview", "to": "bio301-07-pyruvate-oxidation", "strength": "hard", "reason": "Pyruvate is the product of glycolysis that feeds pyruvate oxidation." },
  { "from": "bio301-02-redox-reactions", "to": "bio301-07-pyruvate-oxidation", "strength": "soft", "reason": "Pyruvate oxidation is a redox decarboxylation." },
  { "from": "bio301-07-pyruvate-oxidation", "to": "bio301-08-citric-acid-cycle", "strength": "hard", "reason": "Acetyl-CoA from pyruvate oxidation is the fuel entering the cycle." },
  { "from": "bio301-03-metabolic-pathways", "to": "bio301-08-citric-acid-cycle", "strength": "hard", "reason": "The citric acid cycle is another pathway diagram to trace." },
  { "from": "bio301-08-citric-acid-cycle", "to": "bio301-09-cycle-regulation", "strength": "hard", "reason": "Regulation depends on knowing the cycle's enzymes and intermediates." },
  { "from": "bio301-06-glycolysis-regulation", "to": "bio301-09-cycle-regulation", "strength": "soft", "reason": "Feedback regulation of the cycle mirrors that of glycolysis." },
  { "from": "bio301-10-mitochondria-structure", "to": "bio301-11-electron-transport-chain", "strength": "hard", "reason": "The ETC is embedded in the inner mitochondrial membrane, so its architecture must be known first." },
  { "from": "bio301-08-citric-acid-cycle", "to": "bio301-11-electron-transport-chain", "strength": "hard", "reason": "The NADH and FADH2 the cycle produces are the electron donors to the chain." },
  { "from": "bio301-02-redox-reactions", "to": "bio301-11-electron-transport-chain", "strength": "hard", "reason": "The chain is a sequence of redox reactions ordered by redox potential." },
  { "from": "bio301-11-electron-transport-chain", "to": "bio301-12-proton-gradient", "strength": "hard", "reason": "The proton gradient is built by proton pumping in the electron transport chain." },
  { "from": "bio301-10-mitochondria-structure", "to": "bio301-12-proton-gradient", "strength": "soft", "reason": "The gradient exists across the inner membrane whose structure was covered earlier." },
  { "from": "bio301-12-proton-gradient", "to": "bio301-13-atp-synthase", "strength": "hard", "reason": "ATP synthase is driven by the proton gradient, so the gradient must be understood first." },
  { "from": "bio301-01-energy-and-atp", "to": "bio301-13-atp-synthase", "strength": "hard", "reason": "ATP synthase produces the ATP whose role was established at the start." },
  { "from": "bio301-05-glycolysis-overview", "to": "bio301-14-atp-yield-accounting", "strength": "hard", "reason": "Total yield sums the ATP produced in glycolysis." },
  { "from": "bio301-08-citric-acid-cycle", "to": "bio301-14-atp-yield-accounting", "strength": "hard", "reason": "Total yield sums the NADH and FADH2 from the cycle." },
  { "from": "bio301-13-atp-synthase", "to": "bio301-14-atp-yield-accounting", "strength": "hard", "reason": "Most ATP is made by ATP synthase, so its output must be known to total the yield." },
  { "from": "bio301-05-glycolysis-overview", "to": "bio301-15-anaerobic-fermentation", "strength": "hard", "reason": "Fermentation regenerates NAD+ to keep glycolysis going, so glycolysis must come first." },
  { "from": "bio301-14-atp-yield-accounting", "to": "bio301-15-anaerobic-fermentation", "strength": "soft", "reason": "Comparing fermentation's low yield to aerobic respiration builds on the yield accounting." },
  { "from": "bio301-14-atp-yield-accounting", "to": "bio301-16-respiration-metabolism-integration", "strength": "hard", "reason": "Integration requires the full picture of aerobic energy yield." },
  { "from": "bio301-15-anaerobic-fermentation", "to": "bio301-16-respiration-metabolism-integration", "strength": "soft", "reason": "Whole-cell metabolism includes anaerobic routes." },
  { "from": "bio301-09-cycle-regulation", "to": "bio301-16-respiration-metabolism-integration", "strength": "soft", "reason": "Integration ties together the regulatory logic seen across pathways." }
]
